[
  {
    "id": "event_ez_pingwang_east",
    "name": "平王东迁 东周开始",
    "year": -770,
    "dynastyId": "dynasty_eastern_zhou",
    "category": "politics",
    "summary": "周平王为避犬戎,在郑、晋、秦护送下东迁洛邑(今洛阳)。周王室直辖地仅余千里,诸侯坐大,春秋时代开始。",
    "historicity": "historical",
    "yearUncertainty": "exact",
    "_schemaVersion": "v0.6",
    "source": "manual"
  },
  {
    "id": "event_ez_zheng_zhuanggong",
    "name": "郑庄公小霸",
    "year": -707,
    "dynastyId": "dynasty_eastern_zhou",
    "category": "war",
    "summary": "郑庄公先后击败周王、诸侯,繻葛之战射中周桓王肩。周天子权威扫地,春秋\"礼崩乐坏\"自此确认。",
    "historicity": "historical",
    "yearUncertainty": "year",
    "_schemaVersion": "v0.6",
    "source": "manual"
  },
  {
    "id": "event_ez_guan_zhong",
    "name": "管仲改革 齐桓首霸",
    "year": -685,
    "dynastyId": "dynasty_eastern_zhou",
    "regimeId": "regime_qi_state_sa",
    "category": "politics",
    "summary": "齐桓公任管仲为相,改革政治、整顿军备、开发盐铁,以\"尊王攘夷\"号召诸侯。葵丘之盟成春秋首霸,九合诸侯一匡天下。",
    "historicity": "historical",
    "yearUncertainty": "year",
    "_schemaVersion": "v0.6",
    "source": "manual"
  },
  {
    "id": "event_ez_jin_wengong",
    "name": "晋文公称霸 城濮之战",
    "year": -632,
    "dynastyId": "dynasty_eastern_zhou",
    "regimeId": "regime_jin_state_sa",
    "category": "war",
    "summary": "流亡十九年的晋公子重耳归国即位,即晋文公。城濮之战\"退避三舍\"大败楚军,继齐桓之后成为春秋第二霸主。",
    "historicity": "historical",
    "yearUncertainty": "exact",
    "_schemaVersion": "v0.6",
    "source": "manual"
  },
  {
    "id": "event_ez_chu_zhuangwang",
    "name": "楚庄王问鼎中原",
    "year": -606,
    "dynastyId": "dynasty_eastern_zhou",
    "regimeId": "regime_chu_state_sa",
    "category": "diplomacy",
    "summary": "楚庄王陈兵周郊,问鼎之轻重,被王孙满\"在德不在鼎\"训斥。\"问鼎中原\"\"一鸣惊人\"皆典出此王。后邲之战大破晋军成春秋三霸。",
    "historicity": "historical",
    "yearUncertainty": "year",
    "_schemaVersion": "v0.6",
    "source": "manual"
  },
  {
    "id": "event_ez_kongzi",
    "name": "孔子周游列国 创立儒家",
    "year": -497,
    "dynastyId": "dynasty_eastern_zhou",
    "regimeId": "regime_lu",
    "category": "culture",
    "summary": "鲁国孔丘以\"克己复礼\"为志,周游列国十四年欲行其道,皆不得用。归鲁后修《诗》《书》,作《春秋》。儒家学说影响中华文明两千五百年。",
    "historicity": "historical",
    "yearUncertainty": "year",
    "_schemaVersion": "v0.6",
    "source": "manual"
  },
  {
    "id": "event_ez_laozi",
    "name": "老子出关 著《道德经》",
    "year": -500,
    "dynastyId": "dynasty_eastern_zhou",
    "category": "culture",
    "summary": "周守藏室史李耳(老子)见周衰,西出函谷关。关令尹喜请之著书,留下《道德经》五千言而去,莫知所终。道家学说由此发端。",
    "historicity": "semi-historical",
    "yearUncertainty": "decade",
    "_schemaVersion": "v0.6",
    "source": "manual"
  },
  {
    "id": "event_ez_sun_wu",
    "name": "孙武著《孙子兵法》",
    "year": -512,
    "dynastyId": "dynasty_eastern_zhou",
    "regimeId": "regime_wu_state",
    "category": "culture",
    "summary": "齐人孙武奔吴,以兵法十三篇见吴王阖闾,试以宫女操演立威。后助吴破楚入郢。《孙子兵法》成为中国乃至世界军事学第一经典。",
    "historicity": "historical",
    "yearUncertainty": "year",
    "_schemaVersion": "v0.6",
    "source": "manual"
  },
  {
    "id": "event_ez_yue_goujian",
    "name": "勾践卧薪尝胆 灭吴复国",
    "year": -473,
    "dynastyId": "dynasty_eastern_zhou",
    "category": "war",
    "summary": "越王勾践兵败被吴王夫差囚为奴,归国后卧薪尝胆,任用文种、范蠡、二十二年后灭吴。\"君子报仇,十年不晚\"成华夏精神象征。",
    "historicity": "historical",
    "yearUncertainty": "exact",
    "_schemaVersion": "v0.6",
    "source": "manual"
  },
  {
    "id": "event_ez_three_jin",
    "name": "三家分晋 战国开始",
    "year": -453,
    "dynastyId": "dynasty_eastern_zhou",
    "category": "politics",
    "summary": "韩、赵、魏三家联手灭智氏,瓜分晋国。前 403 年周威烈王正式封三家为诸侯。司马光《资治通鉴》以此为战国起点。",
    "historicity": "historical",
    "yearUncertainty": "year",
    "_schemaVersion": "v0.6",
    "source": "manual"
  },
  {
    "id": "event_ez_tianshi_qi",
    "name": "田氏代齐",
    "year": -386,
    "dynastyId": "dynasty_eastern_zhou",
    "regimeId": "regime_qi",
    "category": "politics",
    "summary": "齐国大夫田和废齐康公自立,被周天子正式册封为诸侯。姜姓齐国从此变田姓齐国,与三家分晋同标志着春秋向战国的根本转变。",
    "historicity": "historical",
    "yearUncertainty": "exact",
    "_schemaVersion": "v0.6",
    "source": "manual"
  },
  {
    "id": "event_ez_shang_yang",
    "name": "商鞅变法",
    "year": -356,
    "dynastyId": "dynasty_eastern_zhou",
    "regimeId": "regime_qin_state",
    "category": "politics",
    "summary": "卫人商鞅入秦,见秦孝公推行变法:废井田、行县制、奖耕战、立军功、徙木立信。秦由弱变强,为日后一统六国奠定制度根基。",
    "historicity": "historical",
    "yearUncertainty": "exact",
    "_schemaVersion": "v0.6",
    "source": "manual"
  },
  {
    "id": "event_ez_sun_bin",
    "name": "围魏救赵 桂陵之战",
    "year": -353,
    "dynastyId": "dynasty_eastern_zhou",
    "regimeId": "regime_qi",
    "category": "war",
    "summary": "魏围赵都邯郸,齐威王以孙膑为军师,田忌率军直取魏都大梁,迫魏军回援,在桂陵伏击大胜。\"围魏救赵\"成兵法经典。",
    "historicity": "historical",
    "yearUncertainty": "exact",
    "_schemaVersion": "v0.6",
    "source": "manual"
  },
  {
    "id": "event_ez_he_zong",
    "name": "合纵连横 苏秦张仪",
    "year": -334,
    "dynastyId": "dynasty_eastern_zhou",
    "category": "diplomacy",
    "summary": "苏秦说六国\"合纵\"抗秦,佩六国相印;同窗张仪游说六国\"连横\"事秦,皆纵横家典范。战国外交博弈达高峰。",
    "historicity": "historical",
    "yearUncertainty": "decade",
    "_schemaVersion": "v0.6",
    "source": "manual"
  },
  {
    "id": "event_ez_meng_zi",
    "name": "孟子论\"民贵君轻\"",
    "year": -320,
    "dynastyId": "dynasty_eastern_zhou",
    "category": "culture",
    "summary": "孔子之孙子思之徒孟轲游说魏齐,主张\"民为贵,社稷次之,君为轻\"。继承并发展孔学,成为儒家\"亚圣\",其性善论与仁政说千年不衰。",
    "historicity": "historical",
    "yearUncertainty": "decade",
    "_schemaVersion": "v0.6",
    "source": "manual"
  },
  {
    "id": "event_ez_zhuangzi",
    "name": "庄子逍遥 道家哲学化",
    "year": -310,
    "dynastyId": "dynasty_eastern_zhou",
    "category": "culture",
    "summary": "宋人庄周著《庄子》,以\"逍遥游\"\"齐物论\"将老子之道哲学化。\"庄周梦蝶\"\"濠梁之辩\"成中国哲学经典寓言。",
    "historicity": "historical",
    "yearUncertainty": "decade",
    "_schemaVersion": "v0.6",
    "source": "manual"
  },
  {
    "id": "event_ez_qu_yuan",
    "name": "屈原投江 端午节缘起",
    "year": -278,
    "dynastyId": "dynasty_eastern_zhou",
    "regimeId": "regime_chu",
    "category": "culture",
    "summary": "楚国大夫屈原忠而被谤,作《离骚》《九歌》开浪漫主义诗风。秦破郢都,屈原闻之投汨罗江。后世端午节、龙舟赛皆为纪念。",
    "historicity": "historical",
    "yearUncertainty": "exact",
    "_schemaVersion": "v0.6",
    "source": "manual"
  },
  {
    "id": "event_ez_changping",
    "name": "长平之战 白起坑赵",
    "year": -260,
    "dynastyId": "dynasty_eastern_zhou",
    "regimeId": "regime_qin_state",
    "category": "war",
    "summary": "秦将白起诱赵括出战,围困四十六日。赵军降卒四十万被坑杀于长平。赵国元气大伤,从此六国再无力抗秦,统一已成定局。",
    "historicity": "historical",
    "yearUncertainty": "exact",
    "_schemaVersion": "v0.6",
    "source": "manual"
  },
  {
    "id": "event_ez_jingke",
    "name": "荆轲刺秦",
    "year": -227,
    "dynastyId": "dynasty_eastern_zhou",
    "regimeId": "regime_yan",
    "category": "war",
    "summary": "燕太子丹遣荆轲奉樊于期首与督亢地图入秦行刺,图穷匕见,失败被诛。\"风萧萧兮易水寒\"成千古绝唱,六国最后一搏。",
    "historicity": "historical",
    "yearUncertainty": "exact",
    "_schemaVersion": "v0.6",
    "source": "manual"
  },
  {
    "id": "event_ez_qin_unify",
    "name": "秦灭六国 战国终结",
    "year": -221,
    "dynastyId": "dynasty_eastern_zhou",
    "category": "war",
    "summary": "秦王嬴政自前 230 年起,十年间相继灭韩、赵、魏、楚、燕、齐六国,完成统一。东周与战国时代终结,中国进入大一统帝国时代。",
    "historicity": "historical",
    "yearUncertainty": "exact",
    "_schemaVersion": "v0.6",
    "source": "manual"
  }
]
