[
  {
    "id": "event_xin_wang_mang_usurp",
    "name": "王莽篡汉 建立新朝",
    "year": 9,
    "dynastyId": "dynasty_xin",
    "category": "politics",
    "summary": "外戚王莽以摄政名义代汉自立,改国号\"新\",成为中国历史上少数非禅让而以儒家\"复古\"理念合法化的篡位者。",
    "historicity": "historical",
    "yearUncertainty": "exact",
    "_schemaVersion": "v0.6",
    "source": "manual",
    "body": "## 一位\"完美\"的篡位者\n\n公元 9 年,**王莽以\"摄政\"名义代汉自立,建国号\"新\"**——这是中国历史上少有的\"和平篡位\"。**没有大规模流血,没有军事政变,没有突然的暴力**——王莽通过几十年的政治运作,**在合法形式下完成了篡位**。这种独特模式使他成为中国政治史上最具研究价值的人物之一。\n\n王莽(前 45-公元 23 年)是汉成帝皇后王政君的侄子。**外戚出身**——他叔叔王凤、王商等都做过大将军。但王莽**与其他外戚截然不同**——他**勤俭、好学、礼贤下士**。**他穿粗布衣服,把财富分给穷人,儒家学者对他赞不绝口**——这种形象塑造极其精巧。\n\n王莽的**政治手腕极高**:\n\n**博士儒生**——他在朝中招揽大量儒生,**以\"复古周礼\"为旗号**,赢得知识分子支持\n\n**让贤辞位**——他多次辞官归乡,**每次都因\"民意\"被请回**——这是中国\"以退为进\"的政治表演\n\n**广建谶纬**——他暗中策划各种\"祥瑞\"(白雉、丹石、奇文)**作为天命所归的证据**\n\n**儿子献身**——他的两个儿子涉嫌罪行,**他亲自下令处死**——这种\"大义灭亲\"的姿态加深了民众对他的信任\n\n## 步步攀升\n\n王莽的篡位是**渐进的**——这与项羽的暴力夺权、王莽侄孙王莽刘秀的军事复国都不同:\n\n**前 8 年——任大司马**(三公之一,军事最高长官)\n\n**前 1 年——汉哀帝死后,被王太皇太后再次任大司马**\n\n**公元 1 年——立 9 岁的刘衎为汉平帝**,**王莽以\"安汉公\"称号专政**\n\n**公元 5 年——汉平帝突然死亡**(很可能被王莽毒死)。**王莽立 2 岁的孺子婴为皇太子**,自称\"摄皇帝\"——开始用皇帝礼仪\n\n**公元 9 年——废孺子婴,自立为帝**——国号\"新\"\n\n整个过程**长达 17 年**。每一步都有\"合法\"程序,**每一步都得到一些朝臣的支持**。这是中国历史上最\"温和\"的篡位过程。\n\n## 为什么能成功?\n\n王莽篡汉的成功有几个深层原因:\n\n**汉末政治腐败**——西汉后期外戚、宦官交替专权,**民众对刘氏汉朝失望**\n\n**儒家思想的支持**——王莽推崇\"复古\",**儒家学者多支持他**——他们以为他能恢复周代理想政治\n\n**和平形象**——王莽不像其他权臣那样靠军事威胁,**他的\"和平演变\"反而获得更广泛接受**\n\n**祥瑞舆论**——他制造了大量\"天命转移\"的舆论,**使\"汉应当被新替代\"成为主流观点**\n\n## 现代评价\n\n王莽篡汉在中国政治史上的几层意义:\n\n**它揭示了\"和平篡位\"的可能性**——并非所有改朝换代都需要军事斗争。**和平演变也是路径之一**——但风险是新政权缺乏军事根基(后来王莽迅速败亡就是证明)\n\n**它展示了\"形象塑造\"在政治中的力量**——王莽几十年的\"完美形象\"是他成功的核心。**他证明了\"政治演技\"可以达到改朝换代的程度**\n\n**它也是\"理想主义崩溃\"的样本**——王莽真心想以儒家理念治国,**但他的改革严重脱离实际,导致迅速失败**(详见\"王莽改制\"条目)。**这是中国\"理想主义改革\"的早期失败案例**\n\n**它催生了\"光武中兴\"**——王莽失败后,刘秀以\"恢复汉朝\"为旗号崛起,**最终建立东汉**。从这个意义上,王莽的失败为东汉的成功铺路\n\n考古上,**王莽时期铸造的\"金错刀\"币**精美绝伦,**是中国货币史上的艺术品**。但其复杂的设计(模仿周代刀币)**反映了王莽\"复古\"思想的偏执**——他在货币这种实用品上也要追求\"古制\"。\n\n司马光在《资治通鉴》中对王莽的评价相对客观:**\"莽之初为公时,饬身行俭,克己奉公,所以及致大位者,以人情之所同欲也\"**——王莽早期勤俭奉公,所以能爬到高位,因为人们都向往这种品德。\n\n王莽的故事告诉后世:**伪装可以骗过所有人,但骗不过历史**。他用几十年完美形象赢得了皇位,**但执政后的失败暴露了他的真实能力——一个理论家而非实干家**。**形象塑造是政治的一部分,但执政能力才是政治的核心**——这是王莽留给所有后世政治家的永恒教训。\n"
  },
  {
    "id": "event_xin_reform",
    "name": "王莽改制 复古失败",
    "year": 10,
    "dynastyId": "dynasty_xin",
    "category": "politics",
    "summary": "王莽推行王田制(土地国有)、奴婢禁卖、五均六筦(国营工商)、屡改币制,效仿《周礼》,但脱离实际、操之过急,导致经济崩溃、民怨沸腾。",
    "historicity": "historical",
    "yearUncertainty": "year",
    "_schemaVersion": "v0.6",
    "source": "manual",
    "body": "## 一场理想主义的灾难\n\n公元 10 年起,**王莽推行了中国历史上最激进的\"复古改革\"**——他试图依据《周礼》《尚书》等儒家经典,**把整个汉朝社会改造成\"理想中的周代\"**。这场改革规模庞大、立意崇高,**但执行混乱、脱离实际,最终在 14 年内彻底失败**——直接导致新朝灭亡。\n\n王莽改制是\"**儒家原教旨主义**\"的最早尝试——**严格按照经典执行,不考虑现实条件**。这种思维方式在中国政治史上极其罕见,失败的代价也极其惨痛。\n\n## 改制的具体内容\n\n**王田制**(前 9 年)——把全国土地收归国有,称\"**王田**\"。**禁止私人买卖土地**。家有男丁不足 8 人但土地超过一井(900 亩)的,**多余土地必须分给亲族邻里**——这是中国版的\"土地国有化\"\n\n**奴婢私属**——奴婢不再是商品,**禁止买卖**。但仍维持奴婢身份(只是不能交易)——**既不彻底废除奴隶制,又破坏了既有奴婢市场**,两头不讨好\n\n**五均六筦**——国家垄断**盐、铁、酒、铸钱、林泽税收、五均赊贷**六大产业。比汉武帝的盐铁专营更加全面\n\n**多次改币**——王莽**短短 14 年改了 4 次货币**。每次都把旧币作废,以新币换旧币——比例严重不利民众。**民众财富在每次改币中被洗劫**\n\n**改地名、官名**——按《周礼》把全国地名、官名重新命名。**几乎每个地方、每个官职都改了名**——朝令夕改,行政效率严重下降\n\n**对匈奴改名**——把匈奴单于贬称为\"降奴服于\"——**激怒匈奴,边境战争重燃**\n\n## 改革的失败\n\n王莽改制的失败有几个层面:\n\n**经济**——王田制无法执行(豪强反抗),**几年后被废**;货币改革使民众财富缩水;盐铁专营效率低下。整个经济**陷入崩溃**\n\n**社会**——大规模改名造成混乱;奴婢制度的\"半改革\"使奴婢与主人都不满;**民众生活水平急剧下降**\n\n**政治**——豪强、地方势力、外族都反对王莽;朝中派系林立;**王莽的\"完美形象\"逐渐崩塌**\n\n**外族**——匈奴、西域诸国、高句丽等纷纷反抗;**新朝边境陷入全面战争**\n\n到公元 17 年,**绿林军在湖北兴起**;同年**赤眉军在山东兴起**——民众起义浪潮汹涌而来。\n\n## 失败的根本原因\n\n王莽改制为什么失败? 几个深层原因:\n\n**理想主义脱离实际**——王莽认为只要按《周礼》做,理想政治就能实现。**他不知道政治是实践,不是理论**。**周代制度成立的条件(部落联盟、农业基础)早已不存在**\n\n**不顾既得利益**——王田制直接侵犯豪强利益,**没有任何配套补偿措施**。豪强必然反抗\n\n**速度过快**——任何重大改革都需要循序渐进。**王莽几年内推行所有改革**,使整个社会无法适应\n\n**缺乏执行能力**——王莽是个理论家,不是实干家。**他下达命令容易,但没有有效的执行系统**——基层官员要么不懂、要么不愿执行\n\n**自我膨胀**——王莽相信自己是\"圣人\",**听不进反对意见**。**他的\"完美形象\"反而成为他听不进真话的障碍**\n\n## 现代评价\n\n王莽改制在中国政治史上的几层警示意义:\n\n**它是\"儒家原教旨主义\"的最早失败案例**——后世王安石变法、戊戌变法、各种激进改革都可以从王莽的失败中吸取教训\n\n**它揭示了\"循序渐进 vs 激进改革\"的根本张力**——任何重大改革都面临这一选择,**激进的改革几乎都失败,循序渐进的成功率更高**\n\n**它展示了\"理论 vs 实践\"的政治悖论**——一个完美的理论可能在现实中产生灾难性后果。**实事求是比理想主义更可靠**\n\n**它催生了\"恢复汉朝\"的政治诉求**——王莽改制失败后,民众怀念汉朝,**为东汉的建立创造了民意基础**\n\n班固在《汉书·王莽传》中评价:\"**自书契以来,乱臣贼子无道之人考其祸败,未有如莽之甚者也!**\"——自从有文字记载以来,作乱的人没有比王莽更糟糕的了!\n\n王莽改制告诉后世:**好心办坏事是政治最危险的状态**。一个真心想造福民众的统治者,**因为方法错误,可能给民众带来比暴君更大的灾难**。**两千年来,王莽是所有理想主义改革者的反面教材**——**他的失败比任何理论都更深刻地说明:政治需要的不仅是善意,更是务实**。\n"
  },
  {
    "id": "event_xin_red_eyebrows",
    "name": "绿林赤眉起义",
    "year": 17,
    "dynastyId": "dynasty_xin",
    "category": "war",
    "summary": "天凤四年,荆州绿林军、青州赤眉军先后举兵,饥民数十万响应。新朝灭亡,中原大乱十余年,东汉得以重建。",
    "historicity": "historical",
    "yearUncertainty": "year",
    "_schemaVersion": "v0.6",
    "source": "manual",
    "body": "## 王莽末年的双重起义\n\n公元 17 年起,**两支大型农民起义军在新朝兴起**——**绿林军**(起源于湖北绿林山,以山为名)与**赤眉军**(起源于山东,士兵把眉毛涂红以示区分,故名)。两支起义军**南北呼应,共同摧毁了王莽的新朝**。\n\n起义的根本原因是**王莽改制造成的全面经济崩溃**——民众生活无以为继,**只能造反求生**。这两支起义军是中国历史上**第一次\"双重起义\"**——同时在两个地区爆发,而且都成势力。\n\n## 绿林军的兴起\n\n公元 17 年,**饥民王匡、王凤在湖北绿林山**(今湖北京山)起事。最初只是数百流民求生,**很快聚集到数万**。\n\n绿林军的特殊之处:**它吸收了大量原汉室宗族**(刘氏)。**刘秀、刘縯兄弟**就在绿林军体系中。这种\"皇族 + 流民\"的组合,**使绿林军获得了既有军事力量、也有政治合法性**——能够打着\"恢复汉朝\"的旗号。\n\n公元 23 年,绿林军**立刘玄(汉室宗族)为更始帝**——这是新朝末年第一个公开的\"汉廷重建\"。同年,**昆阳之战大败王莽 42 万军**(详见同名条目),新朝命运被定。\n\n公元 23 年九月,**绿林军攻入长安**。**王莽躲在渐台被乱兵杀死**——尸体被分而食之。新朝灭亡。\n\n## 赤眉军的兴起\n\n与绿林军同期,**山东樊崇率赤眉军兴起**(公元 18 年)。赤眉军主要是流民组成,**比绿林军更\"草根\"**。他们与绿林军有合作但不完全统一。\n\n公元 25 年,**赤眉军立刘盆子(汉室宗族,放牛娃出身)为帝**——这是个奇特的政治安排。**刘盆子年仅 15 岁,完全是傀儡**——赤眉军实际由樊崇等人控制。\n\n赤眉军后来与绿林军建立的更始政权发生冲突。**公元 25 年九月,赤眉军攻入长安,杀更始帝刘玄**。但赤眉军到长安后**找不到粮食**——长安周围已经凋敝。**他们只能退出长安**,流窜河北。\n\n公元 27 年,**赤眉军被刘秀击败**。樊崇等首领被诛,**赤眉军彻底瓦解**。\n\n## 两军起义的不同命运\n\n绿林军与赤眉军的不同命运,**反映了起义军的内部逻辑差异**:\n\n**绿林军**——吸收了汉室宗族,有\"恢复汉朝\"的政治旗号。**这一旗号既凝聚力量,又限制了无限暴力**。但绿林军内部派系复杂,刘玄称帝后**杀了刘秀的哥哥刘縯**——这一仇恨使刘秀脱离绿林,自立门户\n\n**赤眉军**——纯粹的流民集团。**没有政治理念,没有长远规划**。他们以\"恢复汉朝\"为旗号但不知如何治理。**到长安后立即陷入粮食危机,反映了他们没有储备粮食、组织生产的能力**\n\n两军的失败都不是因为军事失败,**而是因为政治能力不足**——他们能打天下但不能治天下。这一规律在中国农民起义史上反复出现。\n\n## 现代评价\n\n绿林赤眉起义在中国历史上的几层意义:\n\n**它是中国第二次大规模农民起义**——继陈胜吴广(秦末)之后的又一次\"民众反抗暴政\"\n\n**它直接导致新朝灭亡**——王莽虽有四十万大军,**也挡不住饥民的怒火**\n\n**它展示了\"流民起义 vs 政治起义\"的差异**——绿林军有政治目标(恢复汉朝),发展路径较稳定;赤眉军纯粹是流民,**最终因缺乏政治能力而失败**\n\n**它为东汉建立铺路**——刘秀在两军起义的混乱中**积累实力,最终统一全国**。**没有这场全面起义,刘秀就没有崛起的空间**\n\n考古上,**湖北京山附近的绿林山**至今有起义军纪念性遗址。**山东日照、莒县一带**是赤眉军最初活动地区。这些地区出土的**新朝末年遗存**反映了战乱的痕迹。\n\n绿林赤眉起义告诉后世:**当政府使民众无路可走时,造反不仅是权利,而且是必然**。王莽虽然主观上想造福民众,**但他的改革实际上把民众推向绝境**。**这两支起义军的兴起,既是王莽暴政的自然结果,也是中国\"民贵君轻\"传统的实际验证**。\n"
  },
  {
    "id": "event_xin_wang_mang_death",
    "name": "新朝灭亡 王莽身死",
    "year": 23,
    "dynastyId": "dynasty_xin",
    "category": "politics",
    "summary": "更始元年,绿林军入长安,王莽于渐台被乱兵所杀,首级悬于宛市。新朝立国十五年而亡,中国唯一的\"复古王朝\"实验破产。",
    "historicity": "historical",
    "yearUncertainty": "exact",
    "_schemaVersion": "v0.6",
    "source": "manual",
    "body": "## 帝国的最后一夜\n\n公元 23 年九月,**绿林军攻破长安城外的最后防线**,**冲入皇宫**。**王莽与他的亲信躲在未央宫的\"渐台\"上**——这是一座建在水中的高台,周围有水池保护,**最后的避难所**。\n\n那一夜,**王莽 68 岁**——他从一个外戚少年到权倾一时的辅政大臣,再到代汉自立的皇帝,经过 14 年的统治,在乱军中等待死亡。**他身穿红色礼服,手持皇帝威仪用的\"威斗\"**(一种法器),**面无表情地等待结局**。\n\n绿林军士兵冲上渐台,**亲信全部被杀**。一个**叫商人的小军官杜吴**杀了王莽——**杜吴并不知道这就是皇帝,直到事后从尸体上取下绶带才发现**。**校尉公宾就**割下王莽的头献给主帅。\n\n王莽的尸体**被乱兵分尸**——舌头被割下、肠胃被掏出、肢体被切碎,**百姓为分尸而互相争斗**。这是王莽 14 年暴政积累的全部仇恨的爆发。\n\n## 头颅的离奇命运\n\n王莽的头颅**没有被埋葬**。它被送到宛城(刘玄当时的临时驻地),**悬挂在街市示众**。民众**以瓦砾投掷**,有人**割下舌头**(因为王莽生前能言善辩)、**剜下眼睛**(因为他善于伪装)。\n\n更离奇的是,**王莽头颅被收藏起来**——历代王朝都把它当作\"乱臣贼子\"的标本保存。**一直到西晋时**(公元 295 年),**洛阳武库失火,王莽头颅才被烧毁**——被保存了 272 年。\n\n这种\"长期保存敌人头颅\"的做法**在中国历史上极其罕见**——它反映了王莽在传统史学中\"乱臣贼子\"形象的极端性。\n\n## 新朝的终结\n\n王莽死,**新朝 14 年(公元 9-23 年)**正式终结。新朝是中国历史上**最短命的\"大一统\"王朝之一**——比秦的 14 年还要短。\n\n新朝灭亡后,**中国陷入长达三年的政治混乱**——绿林军立的更始帝刘玄、赤眉军立的刘盆子、各地割据的军阀(隗嚣、公孙述、窦融等)、**最终崛起的刘秀**——多方势力角逐天下。\n\n到公元 25 年,**刘秀在河北称帝**(沿用汉号,史称东汉)。**经过 12 年统一战争,刘秀在公元 36 年统一全国**——东汉正式建立。\n\n## 王莽的历史评价\n\n王莽在传统史学中**长期是\"乱臣贼子\"的代表**。班固在《汉书》中专设\"王莽传\"——位列\"列传\"末尾,与陈胜并列。班固评价王莽:**\"惟王莽夙夜在公,克己奉公,行义如此,其为众所归往,固宜也**\"——他评价王莽前期勤俭奉公,但后期暴政误国,**功过参半**。\n\n但近代以来,**王莽的形象有所修正**:\n\n**胡适**——称王莽是\"**一千九百年前的社会主义者**\"。理由是他的王田制、奴婢私属等政策,**与现代社会主义有相似之处**\n\n**民国学者**——重新评价王莽改革的进步意义,认为他的失败是\"理想主义遭遇现实\"\n\n**现代史学**——更倾向于把王莽视为\"**复古空想家**\"——他不是奸臣,但他的能力配不上他的理想\n\n## 现代评价\n\n王莽之死与新朝灭亡的几层意义:\n\n**它是中国\"理想主义改革失败\"的最经典案例**——任何脱离实际的改革都会失败,**无论改革者主观上多么真诚**\n\n**它揭示了\"民众怒火\"的可怕**——王莽不是被军队打败的,**主要是被全国民众的怒火吞没**。**当一个政权失去民心时,它的灭亡只是时间问题**\n\n**它创造了\"中国第一个空位期\"**——从王莽死到刘秀统一,**中国经历了 13 年的政治真空**。这是历史上少有的\"无主时期\"\n\n**它为东汉建立创造了机会**——刘秀的成功,**很大程度上得益于王莽留下的政治遗产**——民众思念汉朝、儒家学者愿意支持新汉、各地势力没有足够的整合能力\n\n考古上,**陕西西安附近的渐台遗址**虽已不存,**但相关历史地点(如未央宫、长乐宫)的考古发掘**反映了新朝末年的混乱。\n\n王莽之死告诉后世:**任何政治家都不能忽视民众的承受力**。王莽的所有改革主观上都是为了\"建立理想社会\",**但他没有意识到改革的速度与深度超出了民众的承受能力**。**当民众陷入饥荒、社会陷入混乱时,政权的\"道德合法性\"崩溃,任何政权都无法长存**。**这一规律两千年来反复验证,至今仍是政治家最重要的警示**。\n"
  }
]