[
  {
    "id": "event_tang_li_yuan",
    "name": "李渊建立唐朝",
    "year": 618,
    "dynastyId": "dynasty_tang",
    "category": "politics",
    "summary": "李渊于长安称帝,建国号唐。其次子李世民功盖天下,武德九年发动玄武门之变,夺嫡即位,是为唐太宗。",
    "historicity": "historical",
    "yearUncertainty": "exact",
    "_schemaVersion": "v0.6",
    "source": "manual"
  },
  {
    "id": "event_tang_zhenguan",
    "name": "贞观之治",
    "year": 627,
    "dynastyId": "dynasty_tang",
    "category": "politics",
    "summary": "唐太宗李世民以\"水能载舟亦能覆舟\"为治国理念,重用魏征、房玄龄等贤臣,虚心纳谏、轻徭薄赋。二十三年间夜不闭户,胡人称\"天可汗\",中国历史上最被推崇的治世。",
    "historicity": "historical",
    "yearUncertainty": "decade",
    "_schemaVersion": "v0.6",
    "source": "manual"
  },
  {
    "id": "event_tang_xuanzang",
    "name": "玄奘西行求法",
    "year": 629,
    "dynastyId": "dynasty_tang",
    "category": "religion",
    "summary": "玄奘冒禁西出玉门,经西域、中亚至天竺取经。十七年携经像六百五十七部归国,主持长安译场二十年,著《大唐西域记》。",
    "historicity": "historical",
    "yearUncertainty": "year",
    "_schemaVersion": "v0.6",
    "source": "manual"
  },
  {
    "id": "event_tang_wu_zetian",
    "name": "武则天称帝 建立武周",
    "year": 690,
    "dynastyId": "dynasty_tang",
    "category": "politics",
    "summary": "武则天废唐睿宗,改国号周,定都洛阳,成为中国历史上唯一正统女皇帝。在位十五年,推动科举、抑制门阀、重用寒门。705 年神龙政变后归政唐中宗。",
    "historicity": "historical",
    "yearUncertainty": "exact",
    "_schemaVersion": "v0.6",
    "source": "manual"
  },
  {
    "id": "event_tang_kaiyuan",
    "name": "开元盛世",
    "year": 713,
    "dynastyId": "dynasty_tang",
    "category": "politics",
    "summary": "唐玄宗李隆基前期任用姚崇、宋璟等贤相,励精图治三十年。开元天宝年间国力达盛唐顶峰,人口八千万,长安成为世界最大都市。",
    "historicity": "historical",
    "yearUncertainty": "decade",
    "_schemaVersion": "v0.6",
    "source": "manual"
  },
  {
    "id": "event_tang_li_bai",
    "name": "盛唐诗歌 李白杜甫",
    "year": 750,
    "dynastyId": "dynasty_tang",
    "category": "culture",
    "summary": "李白(701-762)\"诗仙\"放浪形骸,杜甫(712-770)\"诗圣\"忧国忧民。两人一相会便如\"青天里太阳和月亮走碰头\",代表中国古典诗歌的巅峰。",
    "historicity": "historical",
    "yearUncertainty": "decade",
    "_schemaVersion": "v0.6",
    "source": "manual"
  },
  {
    "id": "event_tang_anshi",
    "name": "安史之乱",
    "year": 755,
    "dynastyId": "dynasty_tang",
    "category": "war",
    "summary": "范阳节度使安禄山以诛杨国忠为名起兵,攻陷长安。玄宗奔蜀,马嵬坡缢死杨贵妃。八年内乱致大唐人口锐减、藩镇割据,盛极而衰。",
    "historicity": "historical",
    "yearUncertainty": "exact",
    "_schemaVersion": "v0.6",
    "source": "manual"
  },
  {
    "id": "event_tang_huang_chao",
    "name": "黄巢起义",
    "year": 875,
    "dynastyId": "dynasty_tang",
    "category": "war",
    "summary": "盐贩黄巢率众起义,攻陷长安,僖宗奔蜀。十年内乱沉重打击门阀世族,大唐已名存实亡,各地藩镇竞相争雄。",
    "historicity": "historical",
    "yearUncertainty": "exact",
    "_schemaVersion": "v0.6",
    "source": "manual"
  },
  {
    "id": "event_tang_fall",
    "name": "朱温篡唐",
    "year": 907,
    "dynastyId": "dynasty_tang",
    "category": "politics",
    "summary": "宣武节度使朱温弑唐昭宗,逼哀帝禅位,建国号梁(后梁),唐立国二百八十九年而亡。中国进入五代十国大分裂。",
    "historicity": "historical",
    "yearUncertainty": "exact",
    "_schemaVersion": "v0.6",
    "source": "manual"
  },
  {
    "id": "event_tang_xuanwumen",
    "name": "玄武门之变",
    "year": 626,
    "dynastyId": "dynasty_tang",
    "category": "war",
    "summary": "李世民于玄武门设伏,射杀太子李建成、齐王李元吉。逼父唐高祖李渊立其为太子,旋禅位为唐太宗。中国历史上最有名的宫廷政变。",
    "historicity": "historical",
    "yearUncertainty": "year",
    "_schemaVersion": "v0.6",
    "source": "manual"
  },
  {
    "id": "event_tang_wencheng",
    "name": "文成公主入藏",
    "year": 641,
    "dynastyId": "dynasty_tang",
    "category": "diplomacy",
    "summary": "唐太宗以宗室女文成公主嫁吐蕃赞普松赞干布。携工艺、医药、农耕、文字典籍入藏,促汉藏文化大交流。布达拉宫初建即为迎娶。",
    "historicity": "historical",
    "yearUncertainty": "year",
    "_schemaVersion": "v0.6",
    "source": "manual"
  },
  {
    "id": "event_tang_di_renjie",
    "name": "狄仁杰 唐室砥柱",
    "year": 691,
    "dynastyId": "dynasty_tang",
    "category": "politics",
    "summary": "武则天朝宰相狄仁杰,断疑案、谏废武三思、荐张柬之等贤良,劝武后传位唐子。神龙政变得以归唐李,武后\"以李代武\"狄公功首。",
    "historicity": "historical",
    "yearUncertainty": "year",
    "_schemaVersion": "v0.6",
    "source": "manual"
  },
  {
    "id": "event_tang_li_linfu",
    "name": "李林甫口蜜腹剑",
    "year": 740,
    "dynastyId": "dynasty_tang",
    "category": "person",
    "summary": "唐玄宗后期宰相李林甫,排挤忠良十九年。\"口有蜜,腹有剑\"成奸相典。其用胡将致安禄山掌兵,埋下安史之乱祸根。",
    "historicity": "historical",
    "yearUncertainty": "year",
    "_schemaVersion": "v0.6",
    "source": "manual"
  },
  {
    "id": "event_tang_yang_guifei",
    "name": "杨贵妃 马嵬坡缢死",
    "year": 756,
    "dynastyId": "dynasty_tang",
    "category": "person",
    "summary": "唐玄宗宠杨玉环为贵妃,荔枝快马入长安。安史之乱起,玄宗奔蜀,马嵬坡军士哗变,杨国忠被杀,贵妃缢死佛堂。\"红颜祸水\"千年争议。",
    "historicity": "historical",
    "yearUncertainty": "year",
    "_schemaVersion": "v0.6",
    "source": "manual"
  },
  {
    "id": "event_tang_guo_ziyi",
    "name": "郭子仪单骑退回纥",
    "year": 765,
    "dynastyId": "dynasty_tang",
    "category": "war",
    "summary": "回纥与吐蕃合兵入寇,长安震动。年近七十的郭子仪单骑入回纥营,以旧情说服可汗反与唐联手击吐蕃。\"功盖天下而主不疑\"。",
    "historicity": "historical",
    "yearUncertainty": "year",
    "_schemaVersion": "v0.6",
    "source": "manual"
  },
  {
    "id": "event_tang_bai_juyi",
    "name": "白居易 诗魔写《长恨歌》",
    "year": 806,
    "dynastyId": "dynasty_tang",
    "category": "culture",
    "summary": "白居易,字乐天号香山居士。\"老妪能解\"的平易诗风,作《长恨歌》咏玄宗杨贵妃事,《琵琶行》写琵琶女流落。中唐新乐府运动领袖。",
    "historicity": "historical",
    "yearUncertainty": "year",
    "_schemaVersion": "v0.6",
    "source": "manual"
  },
  {
    "id": "event_tang_yuan_he",
    "name": "元和中兴 削平藩镇",
    "year": 815,
    "dynastyId": "dynasty_tang",
    "category": "politics",
    "summary": "唐宪宗李纯任用裴度、武元衡,十余年间削平淄青李师道、淮西吴元济等强藩。藩镇割据短暂中止,史称元和中兴。",
    "historicity": "historical",
    "yearUncertainty": "year",
    "_schemaVersion": "v0.6",
    "source": "manual"
  },
  {
    "id": "event_tang_niu_li",
    "name": "牛李党争 四十年党祸",
    "year": 821,
    "dynastyId": "dynasty_tang",
    "category": "politics",
    "summary": "宰相牛僧孺、李德裕两派党争四十年,内耗国力。文宗叹\"去河北贼非难,去此朝中朋党难\"。中晚唐衰颓之深因。",
    "historicity": "historical",
    "yearUncertainty": "year",
    "_schemaVersion": "v0.6",
    "source": "manual"
  },
  {
    "id": "event_tang_chu_tang_si_jie",
    "name": "初唐四杰",
    "year": 670,
    "dynastyId": "dynasty_tang",
    "category": "culture",
    "summary": "王勃、杨炯、卢照邻、骆宾王并称初唐四杰。王勃《滕王阁序》\"落霞与孤鹜齐飞\"千古名句。打破六朝绮靡诗风,启盛唐气象。",
    "historicity": "historical",
    "yearUncertainty": "year",
    "_schemaVersion": "v0.6",
    "source": "manual"
  }
]