[
  {
    "id": "event_ming_zhu_yuanzhang",
    "name": "朱元璋建立明朝",
    "year": 1368,
    "dynastyId": "dynasty_ming",
    "category": "politics",
    "summary": "贫农出身的朱元璋于应天(南京)称帝,国号大明,年号洪武。出身布衣而成开国之君,中国历史上罕见。",
    "historicity": "historical",
    "yearUncertainty": "exact",
    "_schemaVersion": "v0.6",
    "source": "manual"
  },
  {
    "id": "event_ming_jingnan",
    "name": "靖难之役 永乐迁都",
    "year": 1399,
    "dynastyId": "dynasty_ming",
    "category": "war",
    "summary": "燕王朱棣以\"清君侧\"为名起兵,四年后攻入南京,建文帝失踪。朱棣即位为永乐帝,1421 年迁都北京。中国政治中心北移。",
    "historicity": "historical",
    "yearUncertainty": "exact",
    "_schemaVersion": "v0.6",
    "source": "manual"
  },
  {
    "id": "event_ming_zheng_he",
    "name": "郑和下西洋",
    "year": 1405,
    "dynastyId": "dynasty_ming",
    "category": "diplomacy",
    "summary": "宦官郑和率二百余艘宝船、两万七千人七下西洋,远抵东非肯尼亚海岸。早于哥伦布近百年,中国古代规模最大的海上远航。",
    "historicity": "historical",
    "yearUncertainty": "exact",
    "_schemaVersion": "v0.6",
    "source": "manual"
  },
  {
    "id": "event_ming_yongle_dadian",
    "name": "永乐大典编纂完成",
    "year": 1408,
    "dynastyId": "dynasty_ming",
    "category": "culture",
    "summary": "永乐帝命解缙等召集两千余学者历时五年编成《永乐大典》二万二千卷,集中国古代文献之大成。后多散佚,残卷今存四百余册。",
    "historicity": "historical",
    "yearUncertainty": "exact",
    "_schemaVersion": "v0.6",
    "source": "manual"
  },
  {
    "id": "event_ming_tumu",
    "name": "土木堡之变",
    "year": 1449,
    "dynastyId": "dynasty_ming",
    "category": "war",
    "summary": "宦官王振挟英宗亲征瓦剌,五十万大军于土木堡覆没,英宗被俘。于谦挽天倾,北京保卫战守住江山。明转衰之始。",
    "historicity": "historical",
    "yearUncertainty": "exact",
    "_schemaVersion": "v0.6",
    "source": "manual"
  },
  {
    "id": "event_ming_wang_yangming",
    "name": "王阳明创心学",
    "year": 1508,
    "dynastyId": "dynasty_ming",
    "category": "culture",
    "summary": "王阳明谪龙场驿大悟\"心即理\",提出\"知行合一\"\"致良知\",创阳明心学。冲击程朱理学正统,影响近代东亚思想巨大。",
    "historicity": "historical",
    "yearUncertainty": "year",
    "_schemaVersion": "v0.6",
    "source": "manual"
  },
  {
    "id": "event_ming_zhang_juzheng",
    "name": "张居正改革",
    "year": 1573,
    "dynastyId": "dynasty_ming",
    "category": "politics",
    "summary": "万历首辅张居正推行考成法整顿吏治、一条鞭法简化赋税。十年间国库充盈、边备整肃,延明祚数十年。",
    "historicity": "historical",
    "yearUncertainty": "year",
    "_schemaVersion": "v0.6",
    "source": "manual"
  },
  {
    "id": "event_ming_li_shizhen",
    "name": "李时珍《本草纲目》",
    "year": 1578,
    "dynastyId": "dynasty_ming",
    "category": "science",
    "summary": "李时珍历时二十七年完成《本草纲目》五十二卷,载药物一千八百九十二种。达尔文誉为\"中国百科全书\",被译为多种外文。",
    "historicity": "historical",
    "yearUncertainty": "year",
    "_schemaVersion": "v0.6",
    "source": "manual"
  },
  {
    "id": "event_ming_li_zicheng",
    "name": "李自成入北京 崇祯自缢",
    "year": 1644,
    "dynastyId": "dynasty_ming",
    "category": "war",
    "summary": "李自成农民军攻入北京,崇祯帝煤山自缢,明亡。吴三桂引清兵入关,李自成败退。中国进入明清易代大动荡。",
    "historicity": "historical",
    "yearUncertainty": "exact",
    "_schemaVersion": "v0.6",
    "source": "manual"
  },
  {
    "id": "event_ming_qi_jiguang",
    "name": "戚继光抗倭",
    "year": 1561,
    "dynastyId": "dynasty_ming",
    "category": "war",
    "summary": "倭寇侵扰东南沿海,戚继光募义乌矿工组\"戚家军\",创鸳鸯阵。台州九战九捷,基本平定东南倭患。中国军事史上少见百战百胜之将。",
    "historicity": "historical",
    "yearUncertainty": "year",
    "_schemaVersion": "v0.6",
    "source": "manual"
  },
  {
    "id": "event_ming_xu_xiake",
    "name": "徐霞客游历山川",
    "year": 1613,
    "dynastyId": "dynasty_ming",
    "category": "science",
    "summary": "徐霞客二十二岁始旅行,三十四年间踏遍中国十六省。著《徐霞客游记》,精考喀斯特地貌,系统科学考察先驱。\"明季伟人,千古奇人\"。",
    "historicity": "historical",
    "yearUncertainty": "year",
    "_schemaVersion": "v0.6",
    "source": "manual"
  },
  {
    "id": "event_ming_hai_rui",
    "name": "海瑞 一代清官",
    "year": 1566,
    "dynastyId": "dynasty_ming",
    "category": "politics",
    "summary": "海瑞备棺上《治安疏》直谏嘉靖帝。万历时再启用,任应天巡抚抑豪强、行清丈,死后家无余财。\"海青天\"千古清官象征。",
    "historicity": "historical",
    "yearUncertainty": "year",
    "_schemaVersion": "v0.6",
    "source": "manual"
  },
  {
    "id": "event_ming_li_madou",
    "name": "利玛窦来华传教",
    "year": 1601,
    "dynastyId": "dynasty_ming",
    "category": "religion",
    "summary": "意大利传教士利玛窦,着儒服、习汉语,以西方科技为媒介在华传教。绘《坤舆万国全图》、与徐光启合译《几何原本》,中西文化首次大碰撞。",
    "historicity": "historical",
    "yearUncertainty": "year",
    "_schemaVersion": "v0.6",
    "source": "manual"
  },
  {
    "id": "event_ming_yuan_chonghuan",
    "name": "袁崇焕宁远大捷",
    "year": 1626,
    "dynastyId": "dynasty_ming",
    "category": "war",
    "summary": "袁崇焕守宁远,以一万孤军大败努尔哈赤十三万八旗军,炮伤努尔哈赤(数月后亡)。后被崇祯中皇太极反间计凌迟,九边不保。",
    "historicity": "historical",
    "yearUncertainty": "year",
    "_schemaVersion": "v0.6",
    "source": "manual"
  },
  {
    "id": "event_ming_sahuoer",
    "name": "萨尔浒之战 明军惨败",
    "year": 1619,
    "dynastyId": "dynasty_ming",
    "category": "war",
    "summary": "明集兵 11 万分四路攻后金,努尔哈赤\"凭尔几路来,我只一路去\",五日连破三路。明朝在辽东战略主动权丧失,清开国之战。",
    "historicity": "historical",
    "yearUncertainty": "year",
    "_schemaVersion": "v0.6",
    "source": "manual"
  },
  {
    "id": "event_ming_xu_guangqi",
    "name": "徐光启译《几何原本》",
    "year": 1607,
    "dynastyId": "dynasty_ming",
    "category": "science",
    "summary": "徐光启与利玛窦合译欧几里得《几何原本》前六卷,首次系统引入西方数学。又著《农政全书》60 卷,开西学东渐先河。",
    "historicity": "historical",
    "yearUncertainty": "year",
    "_schemaVersion": "v0.6",
    "source": "manual"
  },
  {
    "id": "event_ming_duomen",
    "name": "夺门之变 英宗复辟",
    "year": 1457,
    "dynastyId": "dynasty_ming",
    "category": "politics",
    "summary": "明英宗朱祁镇土木堡被俘归后软禁南宫七年。景泰帝病重,石亨、徐有贞等夜入南宫迎英宗复位,改元天顺。中国历史上罕见太上皇复辟。",
    "historicity": "historical",
    "yearUncertainty": "year",
    "_schemaVersion": "v0.6",
    "source": "manual"
  },
  {
    "id": "event_ming_yu_qian",
    "name": "于谦保卫北京",
    "year": 1449,
    "dynastyId": "dynasty_ming",
    "category": "war",
    "summary": "土木堡之变后瓦剌兵临北京,兵部尚书于谦立朱祁钰为帝(景泰帝),拒迁都南京之议,率军大破瓦剌。后英宗复辟,于谦含冤被杀。\"粉骨碎身全不怕\"。",
    "historicity": "historical",
    "yearUncertainty": "year",
    "_schemaVersion": "v0.6",
    "source": "manual"
  },
  {
    "id": "event_ming_zheng_chenggong",
    "name": "郑成功收复台湾",
    "year": 1662,
    "dynastyId": "dynasty_ming",
    "category": "war",
    "summary": "明遗臣郑成功率两万五千兵围攻荷兰殖民者占据 38 年的台湾,经九个月围攻迫使其投降。台湾重归中国版图,郑成功被尊为民族英雄。",
    "historicity": "historical",
    "yearUncertainty": "year",
    "_schemaVersion": "v0.6",
    "source": "manual"
  }
]