[
  {
    "id": "event_ej_sima_rui",
    "name": "司马睿建康称帝 建立东晋",
    "year": 317,
    "dynastyId": "dynasty_eastern_jin",
    "category": "politics",
    "summary": "琅琊王司马睿在王导、王敦辅佐下于建康(南京)称帝,延续晋祚。\"王与马,共天下\"门阀政治格局成型。",
    "historicity": "historical",
    "yearUncertainty": "exact",
    "_schemaVersion": "v0.6",
    "source": "manual"
  },
  {
    "id": "event_ej_zu_ti",
    "name": "祖逖北伐 闻鸡起舞",
    "year": 317,
    "dynastyId": "dynasty_eastern_jin",
    "category": "war",
    "summary": "祖逖率部北伐,中流击楫立誓克复中原,曾收复黄河以南。后因朝廷掣肘忧愤而卒,北伐功败垂成。",
    "historicity": "historical",
    "yearUncertainty": "year",
    "_schemaVersion": "v0.6",
    "source": "manual"
  },
  {
    "id": "event_ej_lanting",
    "name": "兰亭雅集 王羲之作《兰亭序》",
    "year": 353,
    "dynastyId": "dynasty_eastern_jin",
    "category": "culture",
    "summary": "永和九年三月三日,王羲之与谢安等四十一人于会稽兰亭修禊,曲水流觞。王羲之乘兴所书《兰亭序》被誉天下第一行书。",
    "historicity": "historical",
    "yearUncertainty": "exact",
    "_schemaVersion": "v0.6",
    "source": "manual"
  },
  {
    "id": "event_ej_feishui",
    "name": "淝水之战",
    "year": 383,
    "dynastyId": "dynasty_eastern_jin",
    "category": "war",
    "summary": "前秦苻坚以八十万大军南下,东晋谢玄率北府兵八万于淝水大破之。\"风声鹤唳、草木皆兵\"典出于此,南北分立局势再度稳定。",
    "historicity": "historical",
    "yearUncertainty": "exact",
    "_schemaVersion": "v0.6",
    "source": "manual"
  },
  {
    "id": "event_ej_tao_yuanming",
    "name": "陶渊明归隐 《桃花源记》",
    "year": 405,
    "dynastyId": "dynasty_eastern_jin",
    "category": "culture",
    "summary": "陶渊明辞彭泽县令\"不为五斗米折腰\",归园田居。其田园诗与《桃花源记》开中国隐逸文学典范。",
    "historicity": "historical",
    "yearUncertainty": "year",
    "_schemaVersion": "v0.6",
    "source": "manual"
  },
  {
    "id": "event_ej_huan_xuan",
    "name": "桓玄篡晋 刘裕北伐",
    "year": 404,
    "dynastyId": "dynasty_eastern_jin",
    "category": "politics",
    "summary": "桓玄废安帝自立,旋为北府兵将领刘裕所灭。刘裕崛起,先后灭南燕、后秦,平桓玄、卢循,终代晋称帝。",
    "historicity": "historical",
    "yearUncertainty": "exact",
    "_schemaVersion": "v0.6",
    "source": "manual"
  },
  {
    "id": "event_ej_fall",
    "name": "刘裕代晋 东晋灭亡",
    "year": 420,
    "dynastyId": "dynasty_eastern_jin",
    "category": "politics",
    "summary": "刘裕逼晋恭帝禅位,建国号宋,东晋立国一百零四年而亡。南朝时代开始。",
    "historicity": "historical",
    "yearUncertainty": "exact",
    "_schemaVersion": "v0.6",
    "source": "manual"
  }
]
